{
  "name": "Birthday Card",
  "description": "A card that says happy birthday.",
  "template": "<b>Hello {{Kristina}}!</b><br/> Happy {{30}}th birthday!<br/> {{turning}} is coming up soon!",
  "headers": [
    {
      "name": "Content-Type",
      "value": "text/html"
    }
  ],
  "dataSchema": {
    "type": "object",
    "properties": {
      "name": {
        "type": "string"
      },
      "age": {
        "type": "number"
      }
    },
    "required": [
      "name",
      "age"
    ]
  },
  "logic": {
    "turning": {
      "+": [
        {
          "var": "age"
        },
        1
      ]
    }
  }
}